ja,en,fil-PH,zh,th,vi,my,id,km
三連クランプ,Triple clamp,triple clamp,三连夹板、三连杆夹钳,"ชุดข้อสือ 3 ห่วงติดกัน, ชุดแคลมป์ข้อเสือ 3 ห่วงติดกัน",Kẹp ba,ြှ ၃ ဆု ကည် ပ်,Klam tripel.,ដង(cid:544)៣(cid:814)(cid:671)(cid:572)ំ ប់(cid:545)(cid:645)
ベルトコンベア （ベルコン）,Conveyor belt,belt conveyor,传送带,สายพานลําเลียง,Băng tải (gọi tắt là Berukon),သရွွဲ့လ ာ်းစက ် ါ်းပတ် (Belt conveyor),Konveyor sabuk (Ban berjalan),ែខ(cid:717)បន(cid:635)ះយន(cid:625)
かけや,Wooden mallet,maso,大木锤,"ค้อนไม้ขนาดใหญ, ่ ตะลุมพุก",Búa,သစ်သာ်းတအူ ကက်း စာ်း,Palu kayu berat,ញញ(cid:819)រេឈ(cid:822)
ランマ,Rammer,pambayo,夯土机、夯锤,"เครื(cid:1143)องกระทุ้ง,ด ิน เครื(cid:1143)องตบดิน",Máy đầm rung,သခမဖှိစက ် (Rammer),Stamper kuda,(cid:676)៉សុីនប(cid:559)(cid:726)ប់ដី
自在クランプ,Swivel clamp,movable clamp,自由夹具,ข้อเสือเป็น (ข้อเสือที(cid:1143) สามารถหมุนไปมาได)้,"Kẹp xoay, khóa xoay",ြှ လည ၍်ဲ့ ရသသာ ညပ် (Adjustable/Movable clamp),Klam universal,ដង(cid:544)(cid:814)ំេសរ(cid:801)
キャッチクランプ,Catch clamp,catch clamp,夹具,"ชุดบีมแคลมป์กับข้อ เสือ, ชุดข้อเสือกับยูแค ลมป์ (ชุดแคลมป์ที(cid:1143)มี แคลมป์ยึดบีมและข้อ เสืออยู่คู่กัน)","Kẹp, khóa",ြှ ဖမ််းညပ်ကရှိ ှိယာ (Catch clamp),Jepitan pancingan,ដង(cid:544)(cid:814)ំ(cid:564)ប់
吊り上げ用クランプ,Lifting clamp,clamp para sa pagbuhat,夹钳吊具,"แคลมป์ยกเหล็ก, แค ลมป์ยก, แคลมป์จับยก เหล็ก",Kẹp nâng Renfroe,ြှ မ ရာတငွ သ် ်း ု သသာ ညပ်,Lifting klam,ដង(cid:544)(cid:814)ំស(cid:688)(cid:676)ប់ស(cid:636) (cid:817)ចេ
直交クランプ,Fixed clamp,right angle clamp,直角交结用夹钳,ข้อเสือตั(cid:1144)งฉาก,"Kẹp cố định, khóa cố đ ịnh",ရုှိကသ် ထာငမ်ဲ့ နက် သသာ ြှ ညပ် (Orthogonal clamp),Jepitan,ដង(cid:544)(cid:814)ំ(cid:598)ក់(cid:688)តង់
ストレートシャックル,Straight shackle,straight shackle,直形钩环,สเก็นตัวย ู(อุปกรณ์ ห่วงโลหะที(cid:1143)ใช้สําหรับ คล้องยึดเข้ากับ อุปกรณ์ต่างๆ),Móc thẳng (hình chữ U),အသခဖာင ်ဲ့ တက် ငွ ်း် (Straight shackle),Mata-rantai lurus,តួ(cid:676)៉សុីន(cid:719)(cid:698)ន(cid:690)ង(cid:688)តង់
滑車,Pulley,kalo / pulley,滑车、滑轮,รอก,"Ròng rọc, Puli",စကသ် ်း,Katrol/Puli,ឧបករណ៏រ(cid:843)ក
クレーン,Crane,crane,吊车,"ปั(cid:1144)นจ, ั(cid:1143)เคนรน","Cần cẩu, cần trục",ဝန ် စက ် (ကရှိန်း် ),Kren,(cid:676)៉សុីនស(cid:636) (cid:817)ច
移動式クレーン,Mobile crane,mobile crane,移动式吊车,ปั(cid:1144)นจั(cid:1143)นชนิดเคลือนท,Xe cẩu tự hành,သရွွဲ့လ ာ်းန္ငှို သ် ညက်ဲ့ ရှိန်း်,Kren jalan,(cid:676)៉សុីនស(cid:636) (cid:817)ចចល័ត
介しゃくロープ,Guide rope,guy rope,补助绳,เชือกพยุงกันส่าย (เชือกที(cid:1143)ห้อยอยู่กับ ของที(cid:1143)ยกด้วยปั(cid:1144))นจั,"Cáp đuôi, cáp kéo lùi",ကရှိန်း် ခဖငပ်ဲ့ စစည်း် ခပန ် ှိန် တငွ ဆ် ယွ ရူ နက်ကြုံှိ်း,Tali teraju,ែខ(cid:717)ពួរជំនួយ
筋かい止めピン,Cross bracing pin,strut end pin,交叉杆固定销,"เดือยล็อคกากบาท, สลักล็อคกากบาท, เดือยล็อคท่อคํ(cid:1144)ายัน นั(cid:1143)งร้าน",Chốt khóa thanh giằng chéo,တသစာင်း် အာ်းခဖညထ်ဲ့ ည်ဲ့ သငွ ်း် ထာ်းသသာသစ်သာ်း တန်း် အာ်း ကတု ထ် ာ်းသည ်ဲ့ တယွ ဆ် က ် ပငင် တု ်,Tap ikatan diagonal,(cid:540)(cid:635)ស់(cid:671)(cid:572) ប់ឧបករណ៏ (cid:598)ក់ចេ(cid:647)(cid:693) ះសសរ
脚柱ジョイント,Leg column joint,stud joint,脚柱接头,ข้อต่อเสานั(cid:1143)งร้าน,Chốt liên kết,သအာကသ် ခ အမ တအ် ဆ က် (Leg column joint),Sambungan tiang kaki,តំណេជ(cid:822)ង
連結ピン,Coupling pin,connecting pin,连接销钉,ข้อต่อ,Chốt nối,တယွ ဆ် ကပ် ငင် တု ် (Connecting pin),Pena hubung,(cid:540)(cid:645)ស់ត(cid:671)(cid:572) ប់
レバーブロック,Lever block,lever block,杠杆式滑车倒链,รอกโยก,"Kích xích căng dây, tă ng đơ xích",လဗ ာ ေသလာက်(စကသ် ်း ) (Lever block),Blok tuas,ប(cid:694)(cid:814)ក(cid:676)នដង
電動のこ（丸のこ）,Electric saw (Circular saw),electric circular saw (circular saw),电动锯（圆锯）,เลื(cid:1143)อยไฟฟ (้เาลื(cid:1143)อยวง เดือน),Máy cưa đĩa,လျှပ်စစ်လ (မာရုန္ကှို ဲ့ ှို),Gergaji listrik,(cid:676)៉សុីនរ(cid:622)រ
モンキースパナ,Adjustable wrench,monkey spanner,活扳手,ประแจเลื(cid:1143)อน,Mỏ lết có điều chỉnh,ရွ င ် (Monkey spanner),Kunci Inggris,ឧបករណ៏េ(cid:598)ះប៊ូឡ(cid:813) ង
親綱支柱,Main rope post,poste ng pangunahing lubid,主绳支柱,เสายึดเชือกป้องกัน การตก (เชือกสําหรับ เกี(cid:1143)ยวตะขอสายรัดตัว กันตก),Cột giăng dây neo,လခ ု ြုံ ‌သရ်း ါ်းပတက်ကြုံှိ်းက ှို ှိ တဆ် သွ ညက်ဲ့ကြုံှိ်းက ှို သထာက ် သ ညတ်ဲ့ ငှို ်,Tiang pendukung tali induk,(cid:688)បព័ន(cid:640)ែខ(cid:717)សុវត(cid:630)ិ(cid:671)ព
ブラケット,Bracket,bracket,护在钢桩上的牛脚、隅 撑,นั(cid:1143)งร้านท้าวแขน,"Dầm hẫng, công son, thanh giằng chống giữ tường",အထနှိ ်း် အသထာက်,Braket/penopang,ែកង(cid:688)ទ
梯子,Ladder,hagdan,梯子,"บันไดพาด, บันไดพับ",Thang,လပု ်ငန်း် ငွ သ် ်း ု သလက ာ်း,Tangga,ជេណ(cid:625)(cid:822)រ(cid:598)ក់
